{
  "protocol_version": "0.1",
  "run_id": "run_zero_findings_20260817_001",
  "begin": {
    "protocol_version": "0.1",
    "idempotency_key": "idem_zero_run_20260817_001",
    "stream_id": "generic.zero-findings",
    "producer": {
      "producer_id": "openai-monitor-jp",
      "type": "custom_agent",
      "name": "Japan Rewards Semantic Monitor",
      "version": "0.1.0"
    },
    "task": {
      "task_type": "semantic_change_monitor",
      "definition_id": "jro-eight-source-pilot",
      "definition_version": "0.1"
    },
    "expected_scope": {
      "source_ids": [
        "jp.paypay.example"
      ],
      "subjects": [
        "PayPay"
      ],
      "queries": [
        "PayPay reward program official change"
      ],
      "metadata": {
        "cadence": "daily"
      }
    },
    "started_at": "2026-08-17T09:00:00+09:00",
    "parent_run_id": null,
    "metadata": {
      "synthetic": true,
      "purpose": "prove completed zero-finding run"
    }
  },
  "batches": [],
  "complete": {
    "protocol_version": "0.1",
    "run_id": "run_zero_findings_20260817_001",
    "idempotency_key": "idem_zero_complete_001",
    "status": "completed",
    "completed_at": "2026-08-17T09:06:00+09:00",
    "actual_scope": {
      "source_ids": [
        "jp.paypay.example"
      ],
      "subjects": [
        "PayPay"
      ],
      "queries": [
        "PayPay reward program official change"
      ],
      "metadata": {
        "checked": true
      }
    },
    "stats": {
      "sources_attempted": 1,
      "sources_succeeded": 1,
      "findings_submitted": 0,
      "evidence_submitted": 0,
      "batches_submitted": 0
    },
    "errors": [],
    "metadata": {
      "synthetic": true
    }
  }
}
